page,para_num,pdf_name,text
22,8,switzerland_2020,"It is interesting to note that while other quantum technologies such as quantum communication and quantum sensing have not received the same level of attention or funding from the tech giants listed above, these technologies have received significant interest (and funding ) from various national initiatives because of the obvious importance of secure communications and superior defence capabilities for national  security.  "
22,10,switzerland_2020,"Much  in the same  way  that  physicists  led the way  during  the first  quantum  revolution,  right  up to the invention  of the semi -conductor  transistor,  the subsequent  successful  development  of integrated  circuits and the laser necessitated educating engineers about solid -state physics. Today, solid -state electronics is a standard – and integral – part of all electronic engineering degree programmes. Back then, engineers  had to be educated  – by physicists  – about  quantum  physics.  By learning  the “language”  of quantum  physics  and developing  a basic  intuition  about  it, the necessary  basis  for fruitful  communication  was  established.  We are in the same  situation  today,  where  cross -disciplinary  skills  are at an even  greater  premium  given  the inherent  complexity  of quantum  technologies  at this point  in time.  "
22,11,switzerland_2020,"Several  universities  and national  initiatives  have  already  recently  established  courses  in quantum engineering while others have established centres for doctoral training (CDTs ) in quantum technologies,  some  of them  over  five years  ago,  e.g. University  College  London  (UCL ) in the UK. At UCL , the participants in the first CDT (which was called “Developing Quantum Technologies” ) were predominantly physicists – today there is a much greater proportion of engineers, computer scientists, chemists  in the quantum  CDTs.53 "
26,1,switzerland_2020,This is encouraging news for the current suppliers of QKD systems (both larger companies with a broad telecommunications equipment product portfolio like Toshiba and smaller companies with a focused portfolio like ID Quantique in Geneva) and it will drive the demand for QKD systems that have longer reach and faster bit rates. One indication of this increased interest are the recent investments made by South Korea Telecom and Deutsche Telekom – both telecommunication network operators – in ID Quantique.62
26,2,switzerland_2020,Industrial engagement within the field of quantum sensing is much more fragmented given the broad nature of the potential applications across a large number of different industries combined with the fact that no killer application has yet been identified: quantum sensing typically improves the sensitivity/accuracy for known applications or provides a cheaper/smaller alternative to existing sensing solutions.
26,3,switzerland_2020,"It is worth pointing out, however, that technologies such as quantum imaging (providing enhanced visibility in bad lighting conditions, including the ability to see around corners) and quantum timing (the ability to navigate autonomously without an operational satellite-based GPS infrastructure) are applications that are of great interest to the defence industry, where price often takes a second seat to performance. "
26,4,switzerland_2020,"In some instances, it may make more sense to incorporate the quantum sensors into an existing system thereby directly introducing quantum technologies into an existing industry. As many of these sensors measure parameters that are of interest across a broad range of industries and applications, many industries will become “quantum conversant” in this manner. In other cases, it may make more sense to provide a complete stand-alone system (whole product), which may be a more suitable proposition for a start-up rather than an established company. Either way, the fragmented nature of the space represents an interesting niche for both start-ups and industrial partners already providing sensing solutions that could be enhanced by quantum technologies."
26,5,switzerland_2020,"In 2016, Denmark established a national quantum initiative, the objective of which was to “bring quantum technologies to market” by “investing in activities that contribute as much as possible to the full application potential of quantum technology”.63 The consortium comprises three Danish universities (along with three non-Danish universities) and 16 industrial partners, half of which are non-Danish. The total budget for the first two-year phase of the initiative was approximately 21 million Euro: 10.5 million from the Innovation Fund Denmark (a Danish funding agency that invests in knowledge-based initiatives that will create growth and jobs) and 10.5 million from university and industrial partners in the form of cash and in-kind contributions. The scope of the activities covers quantum computing (including quantum algorithms), quantum communication, and quantum sensing (including quantum metrology). A significant proportion of the funded activities were collaborative projects between university and industrial partners. In addition to the technical work packages, there is also a work package dedicated to business development, the objective of which is to:"
27,3,switzerland_2020,"The university community aims to train and build an innovation culture, provide business development support for new businesses (start-ups) or new products in existing businesses, and create broader awareness and understanding among (non-quantum) stakeholders of the potential of quantum technologies. "
27,4,switzerland_2020,"Qubiz built upon a number of research centres of excellence within quantum technologies funded by the Danish National Research Foundation and two more were initiated shortly after Qubiz started. Despite this and a number of positive results from the initial phase, the funding for the second (three-year) phase was not granted by the Innovation Fund Denmark, illustrating the importance of matching the expectations and investment horizon of the funding source with the maturity of the technology. It also underscores the importance of establishing a broadly-based coalition of stakeholders with a long-term, strategic funding perspective. "
27,5,switzerland_2020,"In 2015, The Netherlands established a ten-year quantum initiative, QuTech, with the mission to “develop scalable prototypes of a quantum computer and an inherently safe quantum internet”. The initiative, which grew out of a two-year precursor project of the same name, is built up around several departments at the Technical University of Delft (TUD) and the Netherlands Organisation for Applied Scientific Research (TNO), but now also includes the Ministry for Economic Affairs, the Ministry for Education, Science and Culture, and the two Dutch organisations responsible for basic research (Netherlands Organisation for Scientific Research NWO) and high-tech investments (Top Sector Alliance for Knowledge and Innovation TKI), respectively. The presence of both Microsoft and Intel on campus at TUD has been instrumental in triggering some components of the funding from NWO and TKI. "
27,6,switzerland_2020,"The total budget for the ten-year period is 146 million Euro, of which approximately one-third is provided by TNO, one-third is provided by NWO and TKI combined, and the remaining one-third is provided by TUD itself. Approximately 80% of the total funding is cash. The programme is organised around three mission-driven science and technology road maps (led by TUD principal investigators): Fault tolerant quantum computing, Quantum internet and networked computing, Topological quantum computing. In addition, there is an engineering road map (led by TNO): Shared technology development (SHD). "
27,7,switzerland_2020,"Since the establishment of QuTech, two new quantum initiatives (with a smaller scope but also mission-driven) have been established in the Netherlands: QuSoft at the University of Amsterdam and the Eindhoven Q Center at the Technical University of Eindhoven. Combined with the highly successful mid-term evaluation of QuTech earlier this year, there was a basis for establishing a quantum national agenda programme (four-year) to bring all relevant stakeholders in the Netherlands, including industry, together to accelerate the economic impact of quantum technologies and address common societal challenges. The strength of a quantum national agenda developed in this manner is that it has grown organically, albeit over a longer period of time, but builds upon established collaborations and relationships and is therefore intrinsically more cohesive than otherwise would be the case."
28,4,switzerland_2020,"In 2016, the Austrian Council of Ministers announced a new national R&D funding programme for quantum research and technology, including demonstrators. The objective of the programme was threefold: to further increase the cooperation of Austrian researchers and companies in European and international initiatives; to enable the development of quantum relevant skills and R&D infrastructure; to support the transfer of R&D results into value and demonstrators. "
28,5,switzerland_2020,"The budget for the initial four -year ramp -up phase (2017 -2021 ) is 32.7 million Euro and is provided through the Austrian Research Promotion Agency, the national funding agency for industrial research and development, and the Austrian Fund for the Promotion of Scientific Research. Funding is allocated on a yearly basis through a competitive application process and projects are evaluated on an annual basis. 4.5 million Euro will be allocated during 2019. "
28,6,switzerland_2020,The scope of the programme is broad in that there are no pre -defined areas within quantum science and technology and it is not mission -driven. The Austrian initiative not only builds upon a number of early initiatives such as the Vienna Center for Quantum Science and Technology and the Erwin Schroedinger Center for Quantum Science and Technology but also specifically strengthens these initiatives as integral parts of the QFTE programme.
28,7,switzerland_2020,The strength of a funding programme of this nature is that it maintains a greater level of flexibility and agility compared to more mission -driven programmes but without the latter’s focus and concentration of resources on specific objectives and outcomes.
4,1,japan_2020,"In a world where major changes can occur in all aspects, as international competition to acquire advanced technologies and realize innovation intensifies, the strengths and Strategic efforts that carefully analyze and evaluate competitiveness and use international collaboration/ cooperation and international competition properly are essential. Currently, the world is in the midst of a historic paradigm shift in economic and social structures."
4,2,japan_2020,"Trends in other countries regarding quantum technology. In other countries, mainly in the United States, Europe, and China, quantum technology is clearly positioned as a strategic core technology, and in recent years, significant investments in research and development have been made. In addition to expansion, it is developing strategic initiatives such as establishing research and development bases and developing human resources."
4,3,japan_2020,"In the United States, through the formulation of the “National Strategy for Quantum Information Science” and enactment of laws related to quantum information science, support for the formation of international research bases through the Department of Energy (DOE) and the National Science Foundation (NSF) It strategically invests more than $200 million in research and development every year, including support for the formation of an industry-academia consortium on international standardization by the National Institute of Standards and Technology (NIST). In addition, the EU has compiled the “Final Report on Quantum Technology Flagship” and has started projects on a scale of 1 billion euros from 2018. In addition, in the United Kingdom, Germany, etc., after positioning a wide range of quantum technologies as important technologies, the government is promoting research and development projects and forming research and development bases, thereby significantly expanding investment."
4,4,japan_2020,"In China, quantum computers are positioned as a major science and technology project, and quantum information. The economy and society are making a discontinuous transition to a knowledge-intensive type that differs from the conventional labor- and capital-intensive type. Appropriately capturing this transition is the key to Japan's international competitiveness. In addition, Japan's geopolitical position and the international environment surrounding high-tech hegemony are undergoing drastic changes. Approximately 7 billion yuan is being invested in the development of the national research laboratory."
4,5,japan_2020,"Outside the government, large IT companies (Google, IBM, Intel, Alibaba, etc.) and venture companies (D-Wave, Rigetti, IonQ, etc.), mainly in Europe, the United States, and China, are developing quantum technologies such as quantum computers. are actively investing in In October 2019, Google announced in the English scientific journal Nature that it had achieved “quantum supremacy” for the first time using a quantum computer that it independently developed. The competition is intensifying, such as announcing that it has demonstrated that it surpasses in computing power."
4,6,japan_2020,"Japan is the first country in the world to advocate “Society 5.0” and “data-driven society” as visions of society that it should aim for in the future. It has become an important technological infrastructure that is the source of power. Quantum technology is the key fundamental technology for further dramatic and discontinuous development of such important technological infrastructure. From this point of view, in recent years, the international attention on quantum technology has been rapidly increasing. We are accelerating our efforts. "
56,1,japan_2020,Foreign trends surrounding quantum technology include government initiatives and efforts of representative companies. The exchange rate is calculated based on the standard foreign exchange rate and the arbitrage foreign exchange rate announced by the Minister of Finance of Japan for the month at the time of the announcement.
56,2,japan_2020,"Overseas, mainly in the United States, Europe, and China, “quantum technology” is positioned as an important technology that will bring about major changes in the economy and society, and government-led research and development strategies are formulated. In recent years, we have significantly expanded R&D investment and strategically developed R&D bases and human resource development. "
56,3,japan_2020,"In June 2017, the European Commission's panel of experts formulated an R&D strategy. Major IT companies in each country are also actively investing, and the establishment and funding of venture companies are also progressing. $3 billion research investment over 5 years (2014-)In addition, each country started research and development with its own budget. Especially, the Netherlands and the United Kingdom formed international research bases. "
56,4,japan_2020,"In September 2018, the National Science and Technology Council formulated a National Strategy Outline for Quantum Information Science. In December 2018, a law was enacted concerning investment of up to $1.3 billion (approximately 140 billion yen) over five years from 2019. Developed a superconducting quantum computer. Raised approximately $120 million. Centered on DOE and NSF, about 10 bases for R&D and human resource development are formed."
56,5,japan_2020,"In the 13th Five-Year Plan for Science and Technology Innovation (2016), quantum communication and quantum computers are positioned as major science and technology projects and are actively invested. Establishment of the National Laboratory for Quantum Information Science in Hefei City, Anhui Province is under construction at a cost of 7 billion yuan (approximately 120 billion yen) (scheduled for completion in 2020). Major IT companies and ventures have also made significant strides. How to advance quantum technology is at a crossroads as global competition intensifies."
49,2,sa_2021,"Quantum technologies are no longer only the purview of laboratory experiments as private industry has quickly adopted the most robust ideas into applications. For example, atomic clocks are a very mature technology: cutting-edge laboratory clocks would not gain nor lose a second in 40 billion years, while chip-scale manufacturing technologies have led to the development of extremely miniaturised clocks that are now commercially available. Technologies working on similar principles to atomic clocks allow for the detection of weak magnetic fields and have been used to fabricate atomic vapour sensor arrays used for brain wave detection. Similarly, the geo-surveying industry is benefiting from commercial gravimeters based on laser-cooled, magneto-optically trapped atoms, while quantum random number generators are available off-the-shelf for quantum encryption. On the quantum computing front, Google, IBM, Microsoft and Lockheed Martin all have quantum computing development projects, with D-wave offering a commercially available quantum computer based on an adiabatic quantum computing architecture with several hundred qubits."
49,4,sa_2021,"The aim of this section is to provide a concise overview of quantum technology strategies and investments worldwide. These efforts are motivated by the current race to develop the world’s best quantum technology. Arguably, the two biggest contestants are the USA and China [3.1]. All strategy documents stress the need of the joint effort of academia and industry to develop the full economic benefits of these new technologies."
50,1,sa_2021,"Developed  nations  have  invested  heavily  over  the  past  two  decades  in  establishing a vibrant  research  community  studying  quantum  computing  and  quantum  technology related  physics [3.2,  3.3].  Many  policy  documents  on  national  efforts  to  develop  these technologies  have  been  compiled  [3.4-3.9],  and  more  recently,  governmental  funding  in many  of  these  countries  have  been  increasingly  funneled  toward  transforming  laboratory successes  into  marketable  technologies  according  to  well-defined  roadmaps [3.10-3.12].  It  is  clear  that  a  new  industry  is  on  the  horizon  with  many  opportunities  to contribute  [3.13],  ranging  from  being  a  full-scale  quantum  computer  and  technology manufacturer  to  a  supplier  of  enabling  technologies  and  quantum  computing  software solutions  for  international  companies."
50,2,sa_2021,"The  United  Kingdom  was  a  pioneer  in  the  establishment  of  national  initiatives.  Its  Strategy  was  published  in  2015  and  has  invested  more  than  £1bn  since  then  [3.14].  In 2014  the  UK’s  National  Quantum  Technologies  Programme  [3.15]  was  launched,  with  The  Quantum  Communications  Hub  led  by  the  University  of  York  [3.16].  The  programme was  renewed  again  in  2019  for  a  further  5  years,  with  investments  in  four  quantum technology  hubs:  Sensors  and  timing,  Quantum  enhanced  imaging  (QuantIC), Quantum  computing  and  simulation,  and  Quantum  communications  Technologies (Quantum  Communications  Hub). This  has  led  to  significant  advances  having  been made  on  the  technology  front,  including  chip-to-chip  QKD,  fibre  based  QKD  over  ~100 km,  and  wireless  QKD  between  a  handheld  device  and  a  wall  mounted  terminal.  The investment  in  Quantum  Computing  covers  the  full  stack  of  hardware  and  software,  from core  technologies  to  potential  applications  including  the  discovery  of  novel  drugs  and materials,  quantum-enhanced  machine  learning,  and  carbon  reduction  through  resource optimisation."
50,3,sa_2021,In  2016  the  European  Union  published  a  Quantum  Technology  roadmap  [3.17]  and a  Quantum  Manifesto  [3.4]  that  formulated  a  common  strategy  for  Europe  to  stay  at  the front  of  the  second  Quantum  Revolution. These  documents  also  induced  a  €1  billion  european  initiative  in  Quantum  Technology. The  current  Quantum  FET  Flagship was  Quantum  Framework.
51,2,sa_2021,"In 2019 several EU member states have signed a declaration in which they commit to exploring the development and deployment within 10 years of a quantum communication infrastructure in the EU. The first stage goal is securing government and critical infrastructure communication across the European Union. The second stage prepares the connection of quantum computers and sensors in a full Quantum Information Network. This quantum communication infrastructure will be used for data transit and storage in a highly secure way. It is designed to ultimately link sensitive public and private communication assets all over the EU, such as banks and administrations. "
51,3,sa_2021,"On 6 March 2020, the European Union presented the Strategic Research Agenda of the Quantum Flagship Project. The document was prepared over an 18 month period in consultation with more than 2000 Quantum Scientists. The executive summary of the document starts with the statement, “It is now widely understood that the mastery of deep technologies will determine the future prosperity of countries and regions across the world. Sovereignty over these technologies will become the critical building block for the future economic development and digital self-determination of societies."""
51,4,sa_2021,The document clearly expresses 5 goals: 1. Quantum Europe - Engage all stakeholders/create an innovative ecosystem. 2. Financing the growth - Build a sustainable quantum industry. 3. From lab to fab to market - Provide the necessary Infrastructure. 4. Strengthening Europe - Create a European IP and standardisation strategy. 5. Education and outreach - Train a quantum-aware workforce and society.
51,5,sa_2021,"Under its 13th five-year plan, introduced in 2016, China has launched a “megaproject” for quantum communication and computing. This project aims to achieve major breakthroughs in these technologies by 2030, including the expansion of China’s Quantum Framework."
52,1,sa_2021,"""National quantum communications infrastructure, the development of a general quantum computer prototype, and the construction of a practical quantum simulator” [3.21]. China is also setting up a National Laboratory for Quantum Information Science in Hefei, a project led by Prof Pan Jianwei [3.22]. The total investment is reported to be in the order of $10bn."
52,2,sa_2021,"China is presently the leader in quantum communications, with the launch of the first QKD satellite (Micius) in 2016 and a low key-rate link over 3000 km. This is the culmination of a decade of research, with an estimated national quantum budget of just short of US$1 billion, building on initial work from 1998 to 2010 with a budget of US$150m [3.23]. Quantum communication featured strongly from the start, with key national projects in long distance QKD as well as space-based QKD. "
52,3,sa_2021,"The experience showed the importance of national flagship projects with directed aims through science, e.g., the “Beijing-Shanghai quantum secure communication backbone” project, funded to the tune of US$490m from 2011-2015 and covering a total distance of 2000 km. Key rates remain low, ~ 10 kbps, but the distance is impressive. "
52,4,sa_2021,"Interestingly, funding has been found both from national and regional governments, and has been distributed across all the core technologies needed for a complete network, both photonic for transmission and solid-state for memory."
52,6,sa_2021,"In terms of BRICS countries, Brazil was off the mark early and has had a sustained investment totally ~US$10m since 2001 [3.24], with a healthy portion dedicated towards quantum communication technologies. In its latest budget (2020) India has allocated 80 billion rupees (about US$1.12 billion) to quantum technology research over the next 5 years. This is a considerable increase on the previous commitment in 2018 of US$27.9."""
53,1,sa_2021,"India is continuing to work on its Plan of Action for Quantum Computing and National Quantum Programme, having announced investment of about 70 million over five years as part of the National Mission on Interdisciplinary Cyber-Physical Systems. Russia has also started related programmes, investing in the order of US$1 billion in quantum technologies as part of the Digital Economy National Program. Quantum technologies are among the nine cross-cutting directions of the program with a total announced budget of around 25 billion EUR. The final budget specifically for quantum technologies is not yet defined, but the amount requested by experts is close to 1 billion EUR. However, the early starter and most successful so far is undoubtedly China."
53,2,sa_2021,"In December 2018, the National Quantum Initiative Act was approved in the United States of America. This law allocates more than US $1.2 billion to a national effort dedicated to quantum information science over the next decade. The funding will be directed to the National Institute of Standards and Technology (NIST), National Science Foundation (NSF) Multidisciplinary Centers for Quantum Research and Education, and to the Department of Energy (DOE) Research and National Quantum Information Science Research Centers."
