page,para_num,pdf_name,text
8,1,germany_2023,"Quantum sensors also offer new applications that are complementary to classic technologies. By directly relating the measurement methods to natural constants, which are defined without uncertainty by the recent redefinition of the SI system of units (2019), they offer novel possibilities for reliable, ubiquitous and highly precise sensor technology. Overall, quantum-based measurement technology is a heterogeneous field with a wide variety of technologies and numerous promising, some of which are already market-ready, application options."
8,2,germany_2023,"This ensures the guarantee of quality, traceable and secured performance parameters and the comparability of QT components. As a cross-sectional task, independent metrological characterization and qualification of components must also be considered and developed from the outset for a stable, trustworthy and reliable value chain in the emerging quantum technology industry."
8,3,germany_2023,"In international comparison, the USA is currently the world leader, particularly in quantum computing. Large corporations such as Google and IBM currently represent the state of the art in the field of superconducting quantum computing. The USA also has the highest number of start-ups in quantum technologies (92), the highest venture capital raised ($2.2 billion from 2001 to 2021) and the most academic research groups (64). The national funding is distributed across a wide range of national agencies and organizations (including NIST, NASA, DARPA) with different thematic and strategic focuses. Total government funding in 2022 was approximately $0.9 billion."
8,4,germany_2023,"Quantum-based measurement technology is probably the field with the highest technological maturity in the field of quantum technologies. For example, nitrogen vacancy centers in diamond are already used in special microscopes. The first quantum gravimeters are also available on the market and enable the measurement of the Earth's gravity field for applications in geology or geodesy."
8,5,germany_2023,"The cross-sectional field of basic technologies (“Enabling Technologies”) is particularly indispensable for the further development of quantum technologies. It is already developing economic potential: the first markets for special lasers, control electronics and cooling technology for quantum systems have already emerged. In particular, highly specialized start-ups and small and medium-sized enterprises (SMEs) are able to generate their first sales. The future challenge will be to develop innovative overall systems from this sum of individual components and to open up further possible uses."
8,6,germany_2023,"Quantum sensing and quantum metrology state of technology in international comparison basic technologies. However, quantum metrology is not only limited to quantum sensing. It is generally concerned with making high-resolution and high-sensitivity measurements of physical parameters using quantum effects such as quantum entanglement. Quantum metrology thus promises the development of measurement techniques that enable greater precision than the same measurement using classical methods. For example, electrical quantum metrology can develop conventional measurement technology into a comprehensive quantum measurement technology. Among other things, programmable “quantum voltmeters” are already available on the market."
8,7,germany_2023,"Assumptions. A wide variety of quantum communication methods have now been demonstrated in applications, both in optical fibers and between satellites and in terrestrial free-beam connections. However, range and data rate still represent a challenge for broad application relevance. For this reason, the development of quantum repeaters, which are required as nodes to extend transmission routes, is essential as a key component for quantum communication over long distances."
9,1,germany_2023,"Use of quantum technologies is growing, especially in the field of quantum computing. However, the North American company's research activity in this area is lagging behind. Significant public funding for quantum technologies has currently been announced in the European Union ($7.2 billion in the EU versus $1.9 billion in the USA). In Germany alone, 2 billion euros are available for research and development in quantum technologies as part of the federal government's future package. "
9,2,germany_2023,"However, there is significantly less venture capital available, especially compared to the USA (0.3 billion compared to $2.2 billion). In terms of scientific publications, the European Union is a leader, both in academic quality and breadth. The number of start-ups has also more than tripled since 2015, but is far below the US figures."
9,3,germany_2023,"It is important for Germany to benefit economically and socially from the development of quantum technologies and to establish sovereign access to this future technology. The initial situation is assessed as follows: Less in international comparison with a total of $15 billion, China has announced by far the highest government funding in an international comparison. "
9,4,germany_2023,"Specific structures and strategies are less transparent, but important work has already been published on a scientific and technological level. With the help of the Micius research satellite, an intercontinental key exchange using quantum cryptographic methods was demonstrated in 2018. There are also increasing developments in quantum computing that indicate a high technological level."
9,5,germany_2023,"Quantum information theory is lacking in science and business within the framework of the dual education system and strong universities. There is a high public investment in the development of quantum technologies, and a good culture of collaboration between distinctive industrial sectors with many potential users of the technology. However, there are hurdles for start-ups and their support, and ongoing research work on almost all relevant technology platforms is needed."
5,1,eu_2005,"The reader can understand the advantages of quantum computing with respect to classical computing and the basic concepts of quantum computer science. This is followed by an article on quantum simulations, which explains how this approach can obtain results circumventing some of the difficulties of universal quantum computation. The article on decoherence presents a fundamental physical issue in QIPC and is one of its critical challenges. Next is a group of nine articles: each presenting a possible specific realization of a quantum information processor (QIP) based on a different physical system. To our knowledge, there exist two realisations of a QIP that are not presented here: one is based on nuclear magnetic resonance and the other one – on quantum dots. To date, no one specific realisation has proved to be the winning one. At present, some of them demonstrate more advantages than others or are at a more advanced stage of development. Only further research can show how a future QIP will look like. The final two articles present concrete spin-off applications of the basic principles of QIPC."
5,2,eu_2005,QIPC in the European Research Programmes: More than 15 years of research. QIPC has a high-risk nature and long-term outlook with visions within the scope of information and communication technologies. The potential of QIPC was quickly recognised by FET – the Future and Emerging Technologies programme of the Information Society Technologies priority of the Research Programme of the European Commission. The pathfinder role of FET played a crucial role for the development of QIPC in Europe.
5,3,eu_2005,"In the late 80’s and early 90’s quantum phenomena were studied by projects funded by the EC in the field of optoelectronics and electronics with the aim to overcome the limitations to the respective state-of-the-art devices. In the Fourth Framework Programme (FP4, 1995 – 1998) this research gradually evolved towards the objective of “quantum information processing”. The focus was on the demonstration of quantum effects with photons, which was technologically more mature. In the mid 90’s, important results were achieved by several groups in Europe and shortly after they became the driving force behind a number of FET projects."
5,4,eu_2005,"During 1998 the QCEPP working group (the so-called Pathfinder project) laid the basis for the research field of Quantum Information Processing and Communications at the European level and was the first endeavour explicitly to address this area of research. This working group produced an extensive report with a roadmap, a map of European research teams with relevant competencies and set the research agenda for several years ahead. It played a crucial role by organising the research community, stimulating it to reach critical mass within a short time period and building the support for the launch of QIPC as a Proactive Initiative."
5,5,eu_2005,"In FP5 (1999 – 2002) FET launched QIPC as a Proactive Initiative (PI). It was implemented via 'calls for proposals' directly targeted to QIPC. There were two calls for proposals and 25 projects were launched with an EU funding of 31 M€. The contracts of the last group of FP5 projects finish at the end of 2005. Coordinating the work of these projects is a main priority of FET. Each year, since the beginning of the proactive initiative, two major events are organised. The first one is a ‘cluster review’ and conference. Its goals are to evaluate the work of each project and how its objectives fit within the cluster, to revise priorities if necessary and to evaluate the progress of the cluster as a whole. The second event is the annual."
6,2,eu_2005,In FP6 (2003 - 2006) QIPC continues as a FET Proactive Initiative. There was one call for Integrated Projects (IP) with deadline 22 September 2004. There are three Integrated Projects which succeeded in the evaluations and negotiations are in progress. Projects are to start in September 2005 with a contract for four years. The total EU funding is 25 M€. These IPs are: • SCALA: Scalable Quantum Computing with Light and Atoms • QAP: Qubit Applications • EuroSQIP: European Superconducting Quantum Information Processor All projects deal with central topics of quantum computing and one of them (QAP) addresses in addition central topics of quantum communication and quantum information. All three consortia involve leading European scientists in their respective fields. In all projects the European dimension is a clear added value.
6,3,eu_2005,"In two of them (SCALA and QAP) the accent on integration across different disciplines and approaches is very strong and it is considered crucial for the further advancement of QIPC research in Europe. QIPC is also funded via the FET-Open continuous submission scheme, which supports long-term, risky and visionary research. In this case the research area is not specified in advance and QIPC projects are competing with all other areas sponsored by FET. In FP5 ten QIPC projects with total cost of 7 M€ and EU funding of 5.6 M€ were launched. "
6,4,eu_2005,"The QUIPROCONE Thematic Network successfully coordinated all QIPC projects in FP5, integrating the projects arising from the Open scheme with those supported through the proactive initiative. In FP6 four projects are already funded via FET Open and others are expected to follow. The role of FET Open is essential as it supports new topics that had not been addressed in the proactive initiative and prevents the time gaps that would otherwise occur by relying solely on dedicated QIPC calls. "
6,5,eu_2005,"In 2004 there was a call for proposals for coordinated actions related to structuring the ERA (European Research Area). The project “Structuring the ERA with quantum information science and technology” or ERA-Pilot QIST was successful and started work on February 1, 2005. It has many challenging objectives with the goal to promote QIPC research in Europe and to give recommendations to European and national authorities on policy, structuring, coordination and funding. The deliverables include: regular updates of the QIPC roadmap document; elaboration of a map of European research teams and expertise; information on national initiatives and programs; information on international initiatives and programs; proposal for coordination and synergies between national and EC initiatives; proposal for benchmarking; organisation of conferences, etc.   "
6,6,eu_2005,"Within QIPC – FET specific efforts were dedicated to quantum cryptography. In FP4 seed work was done by the EQCSPOT project. It led to a wider field of investigation in a number of projects of the QIPC Proactive Initiative in FP5, where they reached maturity. In FP6 this area of research was transferred to more applied parts of the IST programme. Quantum cryptography is now part of the strategic objective “Towards a global dependability and security framework”, where a large Integrated Project SECOQC is funded. The consortium consists of about 40 partners, including several large companies. The EC funding is of 11.35 M€. The project includes all prominent groups in Europe active in this field. They were all initially funded through FET."
7,2,eu_2005,"Apart from the EU program, QIPC is also coordinated and funded on a national level. An extensive list of such initiatives is not available at the moment and it is one of the goals of the project ERA-Pilot QIST. Initiatives exist in the United Kingdom, Denmark, Sweden, Austria, France, Germany, Italy, Slovakia and Poland. Coordination between national and EC programs will have decisive influence on the progress of QIPC research in Europe. Strong and visionary leadership of high quality is also important. Only by stronger coordination between national efforts among each other and with the EC program, can the required critical mass in various sub-fields can be reached and maintained."
7,3,eu_2005,Experience and knowledge should be shared and neither efforts nor funding should be duplicated. Funding will ultimately have to concentrate mainly on centers of excellence specialized in a certain domain in order to achieve the highest possible impact.
7,4,eu_2005,"The field of QIPC has matured in the last ten years. There is critical mass in Europe in the main sub-fields. It is clear that QIPC research has gained an important European dimension which is crucial for its further development. It is, however, necessary to expand and strengthen activities at the European level. We are working towards common goals and a common European strategy. It is crucial to support and maintain research in the main areas of QIPC: quantum communication, computation and information theory."
7,5,eu_2005,"At this stage it is also important to keep a diversity of experimental realizations and approaches, and yet actively to look for synergies and integration between them in order to reach concrete objectives. Some areas of QIPC seem closer to achieving a number of landmark results and have the potential to make possible concrete applications within a medium-term future. We need to ensure timely and appropriate concentration of efforts and coordination of activities in these areas. Breakthroughs of the type needed to make QIPC a reality cannot be expected to follow a precise timetable."
13,3,eu_2_2005,"Quantum Information Processing and Communication (QIPC) is a vigorously active cross-disciplinary field drawing upon theoretical and experimental physics, computer science, engineering, mathematics, and material science. Its scope ranges from fundamental issues in quantum physics to prospective commercial exploitation by the computing and communications industries."
13,4,eu_2_2005,3. 1 QIPC RESEARCH IN EUROPE – EUROPEAN UNION LEVEL QIPC has a high-risk nature and long-term outlook with visions within the scope of information and communication technologies. The potential of QIPC was quickly recognized by FET – the Future and Emerging Technologies part of the Information Society Technologies priority of the Research Programme of the European Commission. The pathfinder role of FET played a crucial role for the development of QIPC in Europe. In the late 80’s and early 90’s quantum phenomena were studied by projects funded by the EC in the field of optoelectronics and electronics with the aim to overcome the limitations to the respective state-of-the-art devices.
13,5,eu_2_2005,"In the Fourth Framework Programme (FP4, 1995 – 1998) this research gradually evolved towards the objective of “quantum information processing”. The focus was on the demonstration of quantum effects with photons, which was technologically more mature. In the mid 90’s, important results were achieved by several groups in Europe and shortly after they became the driving force behind a number of FET projects. During 1998 the QCEPP working group (the so-called Pathfinder Project) laid the bases for the research field of Quantum Information Processing and Communications at European level and was the first endeavor explicitly addressing this area of research. This working group produced an extensive report with a roadmap, a map of European research teams with relevant competencies and set the research agenda for several years ahead. It played a crucial role by organizing the research community, by stimulating it to reach critical mass within a short time period and by building the support for the launch of QIPC as a Proactive Initiative."
13,6,eu_2_2005,"In FP5 (1999–2002) FET launched QIPC as a Proactive Initiative (PI). It was implemented via ‘calls for proposals’ directly targeted to QIPC and a certain amount of the FET budget was reserved in advance. There were two calls for proposals and 25 projects were launched with total cost of 41 M€ and EU funding of 31 M€. The contracts of the last group of FP5 projects finish at the end of 2005. Coordinating the work of these projects is a main priority of FET. Each year since the beginning of the proactive initiative two major events are organized. The first one is a ‘cluster review’ and conference. Its goals are to evaluate the work of each project and how its objectives fit within the cluster, to revise priorities if necessary and to evaluate the progress of the cluster as a whole. The second event is the annual European QIPC workshop where projects present their work. Both forums give the opportunity for interactions between the members of the projects and for cross-fertilization."
13,7,eu_2_2005,"In FP6 (2003–2006) QIPC continues as a FET PI. There was one call for Integrated Projects (IP) with deadline 22 September 2004. There are three Integrated Projects which succeeded in the evaluations and negotiations are in progress. If successful, the projects are to start in September 2005 with a contract for four years. The total EU funding is  25 M€. These IPs are:  SCALA: Scalable Quantum Computing with Light and Atoms;  QAP: Qubit Applications."
14,2,eu_2_2005,"June 2005       14            Version 1.1  EuroSQIP: European Superconducting Quantum Information Processor. The proposed research goes clearly beyond the state-of-the-art, which confirms the strong European presence in QIPC and the progress made in the last years. All projects deal with central topics of quantum computing and one of them (QAP) addresses in addition central topics of quantum communication and quantum information. All three consortia involve leading European scientists in their respective fields. In all projects the European dimension is a clear added value. In two of them (SCALA and QAP) the accent on integration across different disciplines and approaches is very strong and it is considered crucial for the further advancement of QIPC in Europe."
14,3,eu_2_2005,"QIPC is also funded via the FET-Open continuous submission scheme, which supports long-term, risky and visionary research. In this case the research area is not specified in advance and QIPC projects are competing with all other areas sponsored by FET. In FP5 ten QIPC projects with total cost of 7 M€ and EU funding of 5.6 M€ were launched. The QUIPROCONE Thematic Network successfully coordinated all QIPC projects in FP5, integrating the projects arising from the Open scheme with those supported through the proactive initiative. In FP6 four projects are already funded via FET Open and others are expected to follow. The role of FET Open is essential as it supports new topics that had not been addressed in the proactive initiative or allows filling the time gap between dedicated QIPC calls."
14,4,eu_2_2005,"In 2004 there was a call for proposals for coordinated actions related to structuring the ERA (European Research Area). The project “Structuring the ERA with quantum information science and technology” or ERA-Pilot QIST was successful and started work on February 1, 2005. It has many challenging objectives with the goal to promote QIPC research in Europe and to give recommendations to European and national authorities on policy, structuring, coordination and funding. The deliverables include: complete and regularly update the QIPC roadmap document; elaborate a map of European research teams and expertise; collect information on national initiatives and programs; collect information on international initiatives and programs; propose coordination and synergies between national and EC initiatives; propose benchmarking; organize conferences, etc."
14,5,eu_2_2005,"Within QIPC–FET specific efforts were dedicated to quantum cryptography. In FP4 seed work was done by the EQCSPOT project. It led to a wider field of investigation in a number of projects of the QIPC Proactive Initiative in FP5, where they reached maturity. In FP6 this area of research was transferred to more applied parts of the IST programme. Quantum cryptography is now part of the strategic objective “Towards a global dependability and security framework”, where a large Integrated Project SECOQC is funded The consortium consists of about 40 partners, including several large companies. The EC funding is of 11.35 M€. The project includes all prominent groups in Europe active in this field. They were all initially funded through FET."
14,6,eu_2_2005,"2 QIPC RESEARCH IN EUROPE – NATIONAL LEVEL Apart from the EU program, QIPC is also coordinated and funded on national level. An extensive list of such initiatives is not available at the moment and it is one of the goals of the project ERA-Pilot QIST. So far we know that national initiatives of a certain size are the following:  Austria: QIST, consisting of University of Innsbruck, University of Vienna, Austrian Academy of Science, ARC Seibersdorf research as well as the industrial partner Siemens Austria (within the proposed ERA-Pilot represented by Academy of Science and ARC Seibersdorf research)  Belgium: PHOTON – Interuniversity Attraction Pole (IUAP), funded by the federal government, coordinates research in quantum information; additional FP6 QIPC Integrated Projects."
15,2,eu_2_2005,"June 2005       15            Version 1.1 funding of quantum information research  by the Fonds National de la Recherche Scientifique (FNRS)  Denmark: QUANTOP – Danish National Research Foundation Center for Quantum Optics, Universities of Aarhus and Copenhagen  Denmark/Sweden: Øresund-region, consisting of the universities of Lund, Copenhagen, Aarhus and the Technical Universities in Lyngby and Göteborg.  France: “National Initiative on Quantum Information”, part of the “French National Program in Nanoscience”.  Germany: “DFG-Schwerpunkt: Quanteninformationsverarbeitung” (end 2005) and several programs by individual states.  Italy: The National Research Center NEST (National Enterprise for nanoscience and nanotechnology) has been established that contains Quantum Information as well.  Poland: The network of the Laboratory of Physical Foundations of Information Processing, which is coordinated by the Center for Theoretical Physics of the  Polish Academy of Sciences  Slovakia: Quantum information program by the Slovakian Academy of Science (Bratislava).  Sweden: SSF QIP consortium, Chalmers Göteborg, and KTH, Stockholm  United Kingdom: QIP IRC (Quantum Information Processing Interdisciplinary Research Collaboration), consisting of the universities of Bristol, Cambridge, Hertfordshire, Leeds, Oxford (within the QIST-consortium), Sheffield, and York, Imperial College and University College in London as well as the industrial partners Hewlett Packard, Hitachi, National Physics Laboratories, Qinetiq, and Toshiba."
15,3,eu_2_2005,"Coordination between national and EC programs will have decisive influence on the progress of QIPC research in Europe. Strong and visionary leadership of high quality is also important. Only by stronger coordination between national efforts among each other and with the EC program, we can keep or reach critical mass in various sub-fields.  Experience and knowledge should be shared and neither efforts nor funding should be duplicated. Funding will ultimately have to concentrate efforts in sub-fields to certain geographical regions (centers of excellence) in order to achieve the highest possible impact. This need will have to be balanced with the need to keep a European dimension of research while building on already existing centers of excellence in certain areas across Europe."
