page,para_num,pdf_name,text
24,4,eu_2013,"The strategic objective on Security of the IST Research Program had funded SECOQC  – ""Development of a Global Network for Secure Communication based on Quantum Cryptography"" with 11.35 M€ in FP6 . The consortium comprises 40 excellent research groups in the field of applied quantum cryptography to realize an open network for dependable and secure long-range quantum communication building upon a Quantum Key Distribution (QKD) technology. The functionality of the developed architecture has been successfully demonstrated in the end of 2008. In addition the consortium published a White Paper on Quantum Key Distribution and Quantum Cryptography (2007) and started activities on standardization of the developed technolgy."
24,5,eu_2013,"The objective on organic photonics and other disruptive Technologies has funded in FP7 one QIPC project: QuRep  (1.9 M€) on quantum repeaters for secure long-distance communications in state-of-the-art optical fibre-based telecommunication networks. Other projects in the area of QIPC funded by the European Commission research program in general are the two Marie Curie research training networks funded by the Marie Curie program of DG RTD. They are CONQUEST : ""Controlled Quantum Coherence and Entanglement in Sets of Trapped Particles"" and ATOMCHIPS ."
24,6,eu_2013,"Finally, the European Science Foundation (ESF) has funded in 2011 a foresight exercise - or Forward Look - to strategically explore the scientific as well as social dimensions of how the science and technology of Quantum Information advances in the future. This has resulted in the FARQUEST Forward Look  which represents a prospective analysis of the science and technology of Quantum Information, with the goal to synthesise science scenarios of future developments inspired by cross-disciplinary fields - most of which may not yet be thoroughly quantified - for collaborative significant problem-solving. FARQUEST will take an about 10-year horizon on selected research fronts, aiming at getting insight into significant problems of cross-disciplinary nature that could mutually benefit from addressing them through both the perspective of Quantum Information and perspectives of other disciplines."
24,7,eu_2013,"Role of the FET QIPC proactive initiatives. The FET QIPC proactive initiative and its successors play a leading role in connecting the European research activities in the field. Besides providing important funds for research activities they strive to Foster collaboration between research groups in different countries; Facilitate exchange of knowledge, students and researchers between different groups; Establish free movement of knowledge as a fifth freedom in Europe besides people, goods, capital and services."
25,1,eu_2013,"Plan pan-European events and dissemination activities to promote a comprehensive public image of the field through conferences, workshops, common European web portal; Structure and strengthen the research community; Establish and maintain a dialogue with research managers in the member states and at the European level; Define a common strategy for research; Establish a dialogue with industry; Create international alliances and a strategy for international collaboration."
25,2,eu_2013,"In each of the objectives listed above significant progress has been made. Particular highlights have been The establishment of a research agenda which is called QIPC strategic report on current status, visions and goals for research in Europe. 40 leading scientists in QIPC have contributed to this research agenda. It was published in 1999 for the first time with and since then regularly updated. This version is the 8th update."
25,3,eu_2013,"The organization of QIPC conferences. A biannual international conference series on quantum information science and technologies has been started and become a big success. In the last theew editions in Barcelona (2007), Rome (2009) and Zurich (2011) the organizers could attract more than 300 participants not only from Europe, but also from Asia and the US. The next edition of the conference is planned for 2013 in Florence."
25,4,eu_2013,The raising of interest from relevant industry. The coordination actions managed to create links with industrial players active in communication and networking technologies. For example industry sessions have been organized at the QIPC conferences and a dialogue with interested companies has been established. Some of them even joined a research consortium with QIPC scientists to run the European project SECOQC. Overall the ground has been prepared for the swift up-take of commercially interesting results coming out of the QIPC research activities; a list of industries maintaining regular contatcs with the QIPC community is available at this link.
25,5,eu_2013,"The attraction of international partners to collaborative EU research projects. While the QIPC activities have started as a European research programme with mainly partners from Europe, it turned out that more and more research groups from overseas are eager to join in. In consequence the number of international partners in the QIPC projects hase risen in the last calls to about 10% of the total. This development is supported by the availability of funding for these partners under certain conditions such as unique expertise of the partner. The experiences have been very positive so far."
25,6,eu_2013,"The acknowledgement of QIPC researchers' scientific work through numerous prestigious Prizes including the Nobel Prize in Physics in 2005 and in 2012 to mention one. The community is also proud to count around 35 grantees of the European Research Council amongst them. In conclusion, there is good hope that the field of QIPC will keep and even increase its momentum as a locomotive in longterm ICT research and will eventually contribute to the transformation of scientific results into commercially applicable technologies for the benefit of the whole European society."
25,7,eu_2013,"As a basic research field, QIST is still traditionally funded by the different national governmental organisation depending on the country (ministry, governmental agency etc.). These agencies fund every research topics and QIST is typically a small percentage of the overall budget (in the percent range). However many of them have recently developed focus program or umbrella topics for QIST. The identified main national founders for each country are the following."
28,3,eu_2013,"As a highly promising field, QIST is often supported at the local level (city or region). Several examples in Europe have led to the creation of centers for Quantum Information, sometimes in a more general context. This funding can be quite stable in time, and usually consists in particular of a large startup sum, but also in a more long-term support. "
28,4,eu_2013,"One can cite for instance: The region of Catalonia in Spain strongly supported the creation of the Institute for Photonic Science (ICFO) in 2002 in Barcelona, which has a strong emphasis on QIST. This institute is meant to be permanent and, when at full size, will employ up to 300 people; The Region of Tyrol and the city of Innsbruck in Austria also supported the creation of the Institute for Quantum Optics and Quantum Information (IQOQI); this centre was mentioned as ""an example of outstanding quality"" for activity in atomic molecular and optical physics research in a recent report of the US National Research Council; The Region Paris-Ile-de-France through the creation of the Francilian Institute for Research on Cold Atoms (IFRAF), which comprises more than 30 groups from 6 different laboratories in Greater Paris; The United Kingdom is funding an Interdisciplinary Research Collaboration (IRC) in QIPC between leading research universities and industrial laboratories. The initiative started in April 2004 with a funding level of 15M€ in four years; The German ministery for education and research (BMBF) launched in January 2010 a programme on quantum communication as part of its strategic initiative ""IKT 2020"". "
28,5,eu_2013,"These initiatives can either, as for ICFO, create a new centre of excellence, or as in the case of IFRAF, construct a new centre of excellence from an existing pool of competence. In most cases the local funding is motivated by the development of a high-impact scientific field and high-level research, and it has a beneficial impact on local industry and economy."
28,7,eu_2013,"As possible applications of QIST become likely to appear in the near future, start-ups have begun to emerge. The main interest so far is in quantum cryptography, in particular Quantum Key Distribution. The oldest European company is IdQuantique, spin-off from the university of Geneva in 2001. Several new appeared recently: SmartQuantum , created in 2004 in Lagnon, France, Qutools  in Munich, Germany. Other competing start-ups for early adopters on the market are MagiQ , Optemax , and Qinetiq  from the USA. "
28,8,eu_2013,"These companies are mostly spin-off of QIST research groups, funded through the usual start-up scheme: university incubators at the early stage of their existence, then business angels or hedge funds to sustain them beyond their first years of existence. They mainly develop commercial fibered QKD systems, but most of them admit that there is no real market for such system yet. There is however already a small but active market for Quantum-based Random Number Generators ( IdQuantique ). "
28,9,eu_2013,"Quantum computing has also aroused interest for possible commercial applications. However the investment required and the timescale for developing a commercial quantum computer are much larger than for a QKD system.There is no start-up interested in developing a quantum computer in Europe so far, the only example known being in Canada, where one company ( D-Wave ) has been created in 1999."
29,1,eu_2013,"Several very large companies have also interest in QIST, with a focus on applied system research and components. In Europe, the main companies involved are Toshiba (UK), Thalès (France), France Telecom (France), Philips (Netherlands), Pirelli (Italy), Hitachi (UK) Hewlett-Packard (UK). Worldwide, companies such as IBM and NEC are also involved in QIST. The companies either have their own lab (Toshiba, HP, IBM), and/or can alternatively fund research groups (Philips). It has proven practically impossible to obtain reliable information about the amount of investment in QIST by these companies."
29,2,eu_2013,"Another interesting source of funding is the European Space Agency (ESA). Several 50 k€ feasibility studies on Quantum Communication in space were successfully completed since 2002 and one experimental terrestrial 200 k€ study over 144 km horizontal free-space link is ongoing. Within ESA’s science program, the proposal Space-QUEST (to place a QKD terminal onboard the International Space Station) was rated as ‘outstanding’. Several European industries submitted proposals to develop a prototype engineering model of a faint laser and entangled photon source with a total budget of 600 k€. In the second half of 2008 a study on the feasibility of a QKD system on various future satellite missions is expected with 300k€. So far more than 1Mio€ have been spent on the different studies under evaluation at the time this report was made. But the overall budget for the Space-QUEST project, if it is accepted, would be approximately 80 M€ until 2014, with approximately 20% devoted to basic research. If successful, this would make ESA a major funding source for QIST in Europe."
29,3,eu_2013,"3.5 QIPC research in the international context. Quantum information processing has become a scientific discipline with its own identity during the last ten years. The advent of quantum cryptography in the 80s and then the recognition of quantum computing in the 90s, for example using Shor’s algorithm, provided the motivation and have been the starting point of serious experimental and theoretical efforts to realize QIPC at large."
29,4,eu_2013,"Through the activities of the FET proactive initiatives in FP5, FP6 and now FP7, Europe has, in the main, been at the leading edge of QIS worldwide. The early spearheading of this high-risk R&D effort by the EC has aided in the creation of a number of national investments in QIS with the research area now reaching a more mature stage of medium/high risk. Until now, European publication output and quality has been on a par (and even superior) with the US, while other nations have begun systematic ramp-up in QIS investments."
29,5,eu_2013,"In the last years, significant growths in the research efforts within the field of QIST have been made worldwide. Especially the US has fostered their research activities, supported by a number of public funding agencies (for example the National Science Foundation and the Defense Advanced Research Projects Agency). To retain our leading position in research and to capitalize on the Commission’s already significant investments in QIS (50M€ in FP5 and FP6, 45M€ in FP7), it is vital to ensure that the EU investment in QIS remains competitive with the US and other national/continental QIS investors. In the figure below we plot the 2008 funding figures in the QIPC area for the US, Canada, Japan and Europe. QIS R&D support on the scale of ~15M€/year puts Europe below average of worldwide QIS funding support. With such a potential decrease in international competitiveness, there is considerable risk that European research in QIS and the resulting technology developments (commercial and defense), will not be sustainable, leaving Europe reliant on importing such developed QIS technology from abroad."
69,6,uk_2014,"- Quantum nanotechnology implemented on a large scale for power recovery and generation, environmental sensing and efficient healthcare (massive markets for efficient photovoltaics, thermoelectrics and medical sensing / intervention). Novel electromagnetic or chemical (including spectroscopic) sensors and gravity sensors and ""imagers"" are also part of the future forward quantum technologies. Some more work is required to assess the capabilities and utility of quantum sensors over and above the capabilities of classical systems. "
69,7,uk_2014,"- Research and development in the quantum field are highlighted in this part. Quantum technology is being researched vigorously with most developed countries having a practical, or at least theoretical, research programme in place. World class research is conducted in the United States, UK,  China , Australia, Germany, Austria, France , Netherlands, Switzerland, Russia, Japan, Italy, and Canada among others. The competitive playing field is fairly level due to the propensity of the academic world to be very open, and to publish detailed results as soon as they can. There is also a high volume of interchange of researchers between institutions. "
69,8,uk_2014,"- The technological capability of a country thus depends strongly on having a range of world-class institutions characterized by academic freedom, strong academic connections, an appropriate industrial infrastructure, and fabrication facilities. However, this text takes special care to emphasize that a detailed study of the world picture is not a primary purpose of this report. Instead, the focus is on understanding the state of UK's activity in quantum research and identifying the leading institutions in key areas. "
69,9,uk_2014,"- It is clear from our analysis and the discussions at Chicheley on November 10 -12 2013 that the UK has a world-leading, or at least a world-class, academic standing in the majority of quantum technology areas. Details of our pre-eminence in specific areas have been discussed above in section 4. The UK R&D in quantum technology received a significant boost (i.e. £270M over 5 years) in the 2013 Autumn Statement and the challenge now is to maximize the benefit of this extra money."
69,10,uk_2014,"- In terms of inter-institutional collaboration, there is a general need for better connectivity and interaction between universities and teams inside universities. The groups present at the Chicheley meeting felt that there used to be a reasonable alignment between the aim of producing Nature papers and that of producing deliverable technology. However, this alignment is now seen as divergent, particularly in the UK. The new initiative represents a sea change in intent with fields such as engineering and IT reportedly being out of alignment with quantum advancements."
17,2,israel_2018,"The globe, led by the USA, China, Canada, Japan, Germany and the UK, have announced national programs to advance quantum technologies. According to a 2015 McKinsey report, in 2015 alone, 1.5B Euro were invested in non-classified quantum technologies research worldwide. The countries leading in spending were USA, spending 360M Euro, China 220M Euro, Germany 120M Euro, the UK 105M Euro and Canada, spending 100M Euro. The combined European Union expenditure was approximately 550M Euro. "
17,6,israel_2018,"4 For details: Advancing Quantum Information Science: National Challenges and Opportunities, A joint report of the Committee on Science and the Committee on Homeland and National Security of the National Science and Technology Council, July 2016 "
17,7,israel_2018,"5 Review article of the initiative can be found, for example, in Chinese Efforts in Quantum Information Science: Drivers, Milestones, and Strategic Implications - Testimony for the U.S. -China Economic and Security Review Commission, March 16th, 2017, John Costello "
34,1,netherlands_2019,"NATIONAL AGENDA FOR QUANTUM TECHNOLOGYof Amsterdam, Eindhoven University of Technology and Radboud University, and Utrecht is overseeing an NWO spintronics programme. The introduction of research hubs on themes such as energy, health and sustainability has created an excellent opportunity for aligning quantum research with the wishes and requirements of potential end users."
34,2,netherlands_2019,"University of Groningen The Quantum Devices (QD) team is engaged in fundamental research into quantum coherent dynamics in solid-state devices (including organic molecules and semiconductors). The work has clear links to spintronics and quantum information applications, as illustrated by the recent experimental realization of a quantum state ('bit') at wavelengths within the telecommunications range. The Physics of Nano-systems team and the Spintronics and Magneto-optics of Nano materials team (each with one PI) are studying the interaction between the quantum mechanical degrees of freedom 'spin', 'charge', 'valley-chirality' and 'photon chirality' in new 2D materials and their heterostructures."
34,3,netherlands_2019,"The global playing field Although the Netherlands occupies a unique position, it is only one player in a major international push to develop quantum technologies, with Europe, North America and China to the fore. The quantum technology work being done in each of those regions is outlined below."
34,4,netherlands_2019,"Developments in Europe European scientists were very influential in the emergence of quantum mechanics in the early twentieth century; in recent decades, the region has also played a leading role in the further development of quantum technology. Established in November 2016, ERA-Net QuantERA has made several calls for proposals, with a view to funding projects with an emphasis on fundamental quantum technology research. The first call, in 2017, to which the Dutch Research Council contributed 1 million euros, led to the funding of nine projects with Dutch involvement. The exercise was an unprecedented success, with a high return on investment."
34,5,netherlands_2019,"Following publication of the Quantum Manifesto in 2016, the European Union launched a Quantum Technologies Flagship programme in 2017. With a budget of a billion euros, the programme is intended to promote public-private collaboration in Europe, and to establish the region as the world's leading centre for quantum technology development. In 2018, twenty projects were awarded grants totalling 132 million euros. Developments in quantum technology are also funded from other EU sources, including the European Research Council (ERC). In relative terms, the Netherlands does well in these EU programmes, as Figure 13 shows."
34,6,netherlands_2019,"In addition to the quantum technology funding by the EU, various individual member states, including France, Sweden and Switzerland, have their own programmes. Two national programmes warrant particular attention, one because of its pioneering role (UK) and one because its objectives are closely aligned with this Agenda (Germany)."
34,7,netherlands_2019,"United Kingdom The UK is one of the first European countries to invest in a coherent, national programme for quantum technology. In autumn 2013, the British government announced an investment of 270 million pounds (more than 300 million euros) over five years, with the emphasis on translating quantum technology to the market, promoting enterprise and boosting social impact. Cooperation among universities, enterprises and government bodies was encouraged, and the first funds were released at the start of 2015. The programme was therefore one of the first where the translation of quantum technology to industry (and wider society) was a primary objective, rather than solely investment in fundamental research."
34,8,netherlands_2019,"A feature of the programme was the formation of four Quantum Hubs, one for sensors and metrology, one for quantum-based imaging technology, one for networked quantum computing applications, and one for quantum information networks. Further investment in the hubs was announced at the end of 2018: an initial 80 million pounds (93 million euros), followed by a second tranche of 235 million pounds (273 million euros) for continuation and expansion of the national programme. Enabling technologies and education were among the fields targeted for investment."
35,1,netherlands_2019,"NATIONAL AGENDA FOR QUANTUM TECHNOLOGYAnother significant feature of the programme was consultation with all sectors of the community regarding the social and ethical implications of quantum technology. One recent product of that consultative approach was the 2018 Quantum Technologies Public Dialogue Report, commissioned by the British Engineering and Physical Sciences Research Council (EPSRC)."
35,2,netherlands_2019,"Germany  As well as being one of the central players in the Quantum Flagship programme, Germany is investing 650 million euros in its own national programme. With six lines of action, the German programme is intended to reinforce and promote cohesion in the academic world, to develop new technologies for the market, to encourage international collaboration, and to expedite social acceptance and adoption of quantum technology. The main topics addressed are the quantum computer, quantum communication, quantum sensors and basic technologies for quantum systems. Germany's programme therefore has clear parallels with the themes and focuses of our own National Agenda. The interest in quantum computing and artificial intelligence is further illustrated by the funding of about a hundred research posts at the Forschungszentrum Jülich, where a programme with a budget of 36 million euros has been started to investigate quantum and neuromorphic computing: a promising combination of technologies for applications such as quantum machine learning."
35,3,netherlands_2019,"4.3.2 Developments in Canada and the United States Canada  Over the last ten years, the Canadian government has invested 1 billion Canadian dollars (about 660 million euros) in quantum technology research and development. A particular hotspot for quantum technology is the city of Waterloo, whose university campus is home to the Institute for Quantum Computing, the Perimeter Institute for Theoretical Physics and the Mike & Ophelia Lazaridis Quantum Nano Centre, where research into quantum information and quantum computing is concentrated, with nearly four hun dred researchers active. The area also has infrastructure and lab facilities, training institutes for tech-entrepreneurship and Quantum Valley Investment (QVI). Consequently, Waterloo's Quantum Valley serves as a blueprint for a quantum technology ecosystem. Early in 2019, IBM announced that Waterloo would be the only Canadian university to act as an IBM Q-Network partner."
35,4,netherlands_2019,"Through QVI, private investors can contribute to quantum technology research and development. Unusually, researchers funded through QVI will retain the rights to their results and their commercial exploitation. Waterloo University has seeded more than 160 startups, a rapidly increasing proportion of which are working on quantum technology. Canada is consequently fifth in the global rankings for patent applications relating to quantum computing. Strong ties exist between the work being done in Canada and the research at QuSoft and the CWI."
